{
  "$schema": "https://json-schema.org/draft/2020-12/schema",
  "$id": "https://decadencia.es/data/schema/routes.schema.json",
  "title": "Cadencia y Decadencia route database",
  "type": "object",
  "required": ["schema_version", "timezone", "routes", "reviews"],
  "additionalProperties": false,
  "properties": {
    "schema_version": { "const": 1 },
    "timezone": { "type": "string" },
    "routes": { "type": "array", "items": { "$ref": "#/$defs/route" } },
    "reviews": { "type": "array", "items": { "$ref": "#/$defs/review" } }
  },
  "$defs": {
    "id": { "type": "string", "pattern": "^[a-z0-9][a-z0-9-]*$" },
    "date": { "type": "string", "pattern": "^\\d{4}-\\d{2}-\\d{2}$" },
    "datetime": { "type": ["string", "null"], "pattern": "^\\d{4}-\\d{2}-\\d{2}T\\d{2}:\\d{2}:\\d{2}(\\.\\d+)?Z$" },
    "km": { "type": ["number", "null"], "minimum": 0, "maximum": 2000 },
    "meters": { "type": ["number", "null"], "minimum": 0, "maximum": 20000 },
    "seconds": { "type": ["integer", "null"], "minimum": 0, "maximum": 604800 },
    "speed": { "type": ["number", "null"], "minimum": 0, "maximum": 120 },
    "hr": { "type": ["number", "null"], "minimum": 30, "maximum": 230 },
    "latlon": {
      "type": ["array", "null"],
      "minItems": 2,
      "maxItems": 2,
      "items": { "type": "number", "minimum": -180, "maximum": 180 }
    },
    "trackPath": { "type": ["string", "null"], "pattern": "^data/tracks/[a-z0-9-]+\\.json$" },
    "route": {
      "type": "object",
      "additionalProperties": false,
      "required": ["id", "title", "date", "start_time", "type", "distance_km", "elevation_gain_m", "moving_time_s", "elapsed_time_s", "duration_s", "avg_speed_kmh", "avg_hr_bpm", "start_location", "map_center", "track", "preview", "participants", "primary_activity", "pin_primary", "stats_locked", "source_note", "activities"],
      "properties": {
        "id": { "$ref": "#/$defs/id" },
        "title": { "type": "string", "minLength": 1, "maxLength": 120 },
        "date": { "$ref": "#/$defs/date" },
        "start_time": { "$ref": "#/$defs/datetime" },
        "type": { "type": ["string", "null"] },
        "distance_km": { "$ref": "#/$defs/km" },
        "elevation_gain_m": { "$ref": "#/$defs/meters" },
        "moving_time_s": { "$ref": "#/$defs/seconds" },
        "elapsed_time_s": { "$ref": "#/$defs/seconds" },
        "duration_s": { "$ref": "#/$defs/seconds" },
        "avg_speed_kmh": { "$ref": "#/$defs/speed" },
        "avg_hr_bpm": { "$ref": "#/$defs/hr" },
        "start_location": {
          "type": "object",
          "additionalProperties": false,
          "required": ["label", "lat", "lon"],
          "properties": {
            "label": { "type": ["string", "null"] },
            "lat": { "type": ["number", "null"], "minimum": -90, "maximum": 90 },
            "lon": { "type": ["number", "null"], "minimum": -180, "maximum": 180 }
          }
        },
        "map_center": { "$ref": "#/$defs/latlon" },
        "track": { "$ref": "#/$defs/trackPath" },
        "preview": { "type": ["array", "null"], "items": { "$ref": "#/$defs/latlon" } },
        "participants": { "type": "array", "items": { "$ref": "#/$defs/id" } },
        "primary_activity": { "type": ["string", "null"] },
        "pin_primary": { "type": "boolean" },
        "stats_locked": { "type": "boolean" },
        "source_note": { "type": ["string", "null"] },
        "activities": { "type": "array", "minItems": 1, "items": { "$ref": "#/$defs/activity" } }
      }
    },
    "activity": {
      "type": "object",
      "additionalProperties": false,
      "required": ["id", "rider", "source", "source_label", "source_activity_id", "url", "device", "name", "type", "date", "start_time", "distance_km", "elevation_gain_m", "moving_time_s", "elapsed_time_s", "avg_speed_kmh", "avg_hr_bpm", "computed", "track", "map_center", "sha256", "imported_at"],
      "properties": {
        "id": { "$ref": "#/$defs/id" },
        "rider": { "type": ["string", "null"] },
        "source": { "enum": ["gpx", "intervals", "garmin", "strava", "manual"] },
        "source_label": { "type": ["string", "null"] },
        "source_activity_id": { "type": ["string", "null"] },
        "url": { "type": ["string", "null"], "pattern": "^https://" },
        "device": { "type": ["string", "null"] },
        "name": { "type": ["string", "null"] },
        "type": { "type": ["string", "null"] },
        "date": { "$ref": "#/$defs/date" },
        "start_time": { "$ref": "#/$defs/datetime" },
        "distance_km": { "$ref": "#/$defs/km" },
        "elevation_gain_m": { "$ref": "#/$defs/meters" },
        "moving_time_s": { "$ref": "#/$defs/seconds" },
        "elapsed_time_s": { "$ref": "#/$defs/seconds" },
        "duration_s": { "$ref": "#/$defs/seconds" },
        "avg_speed_kmh": { "$ref": "#/$defs/speed" },
        "avg_hr_bpm": { "$ref": "#/$defs/hr" },
        "computed": { "type": "array", "items": { "enum": ["distance_km", "elevation_gain_m", "moving_time_s", "elapsed_time_s", "avg_speed_kmh", "avg_hr_bpm"] } },
        "track": { "$ref": "#/$defs/trackPath" },
        "map_center": { "$ref": "#/$defs/latlon" },
        "sha256": { "type": ["string", "null"], "pattern": "^[0-9a-f]{64}$" },
        "imported_at": { "$ref": "#/$defs/datetime" }
      }
    },
    "review": {
      "type": "object",
      "additionalProperties": false,
      "required": ["id", "status", "routes", "activities", "reason", "metrics", "created_at"],
      "properties": {
        "id": { "type": "string" },
        "status": { "enum": ["open", "merged", "dismissed"] },
        "routes": { "type": "array", "minItems": 2, "maxItems": 2, "items": { "type": "string" } },
        "activities": { "type": "array", "items": { "type": "string" } },
        "reason": { "type": "string" },
        "metrics": { "type": ["object", "null"] },
        "created_at": { "$ref": "#/$defs/datetime" }
      }
    }
  }
}
