{
  "schema_version": 1,
  "timezone": "Europe/Madrid",
  "routes": [
    {
      "id": "salud-2026-10-10",
      "title": "Rivas y alrededores",
      "date": "2026-10-10",
      "start_time": null,
      "type": "MTB",
      "distance_km": 52.21,
      "elevation_gain_m": 472,
      "moving_time_s": null,
      "elapsed_time_s": null,
      "duration_s": 11700,
      "avg_speed_kmh": 16.1,
      "avg_hr_bpm": 133,
      "start_location": {
        "label": "Rivas · Madrid",
        "lat": null,
        "lon": null
      },
      "map_center": [40.347, -3.519],
      "track": null,
      "preview": null,
      "participants": [],
      "primary_activity": "salud-2026-10-10-original",
      "pin_primary": true,
      "stats_locked": true,
      "source_note": "Datos corregidos de la salida del 10 de octubre: 52,21 km y 3h 15m según tu revisión; 472 m+ medidos en Strava (Komoot estimó 607 m). Garmin registró 44,76 km para esa fecha. Se presenta como una única salida, no dos.",
      "activities": [
        {
          "id": "salud-2026-10-10-original",
          "rider": null,
          "source": "manual",
          "source_label": "Salud · Strava",
          "source_activity_id": null,
          "url": null,
          "device": "Strava / Komoot · revisado",
          "name": null,
          "type": "MTB",
          "date": "2026-10-10",
          "start_time": null,
          "distance_km": 52.21,
          "elevation_gain_m": 472,
          "moving_time_s": null,
          "elapsed_time_s": null,
          "avg_speed_kmh": 16.1,
          "avg_hr_bpm": 133,
          "computed": [],
          "track": null,
          "map_center": [40.347, -3.519],
          "sha256": null,
          "imported_at": null,
          "duration_s": 11700
        }
      ]
    },
    {
      "id": "salud-2026-09-27",
      "title": "Torres de la Alameda",
      "date": "2026-09-27",
      "start_time": null,
      "type": "MTB",
      "distance_km": 37.47,
      "elevation_gain_m": 716,
      "moving_time_s": null,
      "elapsed_time_s": null,
      "duration_s": 9360,
      "avg_speed_kmh": 14.38,
      "avg_hr_bpm": 151,
      "start_location": {
        "label": "Torres de la Alameda · Madrid",
        "lat": null,
        "lon": null
      },
      "map_center": [40.403, -3.36],
      "track": null,
      "preview": null,
      "participants": [],
      "primary_activity": "salud-2026-09-27-original",
      "pin_primary": true,
      "stats_locked": true,
      "source_note": "Garmin del 27/09/2026: 37,47 km, 2h 36m, 716 m de subida, velocidad media 14,38 km/h y FC media 151 lpm. No hay track GPX disponible.",
      "activities": [
        {
          "id": "salud-2026-09-27-original",
          "rider": null,
          "source": "manual",
          "source_label": "Salud · Garmin",
          "source_activity_id": null,
          "url": null,
          "device": "Garmin Instinct 3",
          "name": null,
          "type": "MTB",
          "date": "2026-09-27",
          "start_time": null,
          "distance_km": 37.47,
          "elevation_gain_m": 716,
          "moving_time_s": null,
          "elapsed_time_s": null,
          "avg_speed_kmh": 14.38,
          "avg_hr_bpm": 151,
          "computed": [],
          "track": null,
          "map_center": [40.403, -3.36],
          "sha256": null,
          "imported_at": null,
          "duration_s": 9360
        }
      ]
    },
    {
      "id": "salud-2026-09-06",
      "title": "Salida del 6 de septiembre",
      "date": "2026-09-06",
      "start_time": null,
      "type": "MTB",
      "distance_km": 65.71,
      "elevation_gain_m": 453,
      "moving_time_s": null,
      "elapsed_time_s": null,
      "duration_s": 13233,
      "avg_speed_kmh": null,
      "avg_hr_bpm": 135,
      "start_location": {
        "label": null,
        "lat": null,
        "lon": null
      },
      "map_center": null,
      "track": null,
      "preview": null,
      "participants": [],
      "primary_activity": "salud-2026-09-06-original",
      "pin_primary": true,
      "stats_locked": true,
      "source_note": "Garmin del 06/09/2026: 65,71 km, 3h 40m 33s, 453 m+ y FC media 135 lpm. El nombre y la localización del recorrido no figuran en las conversaciones recuperadas; el nombre de la tarjeta es editorial.",
      "activities": [
        {
          "id": "salud-2026-09-06-original",
          "rider": null,
          "source": "manual",
          "source_label": "Salud · Garmin",
          "source_activity_id": null,
          "url": null,
          "device": "Garmin",
          "name": null,
          "type": "MTB",
          "date": "2026-09-06",
          "start_time": null,
          "distance_km": 65.71,
          "elevation_gain_m": 453,
          "moving_time_s": null,
          "elapsed_time_s": null,
          "avg_speed_kmh": null,
          "avg_hr_bpm": 135,
          "computed": [],
          "track": null,
          "map_center": null,
          "sha256": null,
          "imported_at": null,
          "duration_s": 13233
        }
      ]
    }
  ],
  "reviews": []
}
